{"$schema":"https://json-schema.org/draft/2020-12/schema","title":"Itinerary","type":"array","items":{"type":"object","required":["date","destinationId","destination","accommodation","transportation","activities","reservations","estimatedBudget","notes","mapQuery","imageKey","schedule"],"properties":{"date":{"type":"string"},"destinationId":{"type":"string"},"destination":{"type":"string"},"accommodation":{"type":"string"},"transportation":{"type":"string"},"activities":{"type":"array","items":{"type":"string"}},"reservations":{"type":"string"},"estimatedBudget":{"type":"number"},"notes":{"type":"string"},"mapQuery":{"type":"string"},"imageKey":{"type":"string"},"schedule":{"type":"array","items":{"type":"object","required":["hour","activity","transportation","duration","estimatedCost","location","bookingStatus","notes"],"properties":{"hour":{"type":"string"},"activity":{"type":"string"},"transportation":{"type":"string"},"duration":{"type":"string"},"estimatedCost":{"type":"string"},"location":{"type":"string"},"bookingStatus":{"type":"string"},"notes":{"type":"string"}}}}}}}
