[
  {
    "date": "22 ago",
    "destinationId": "bangkok",
    "destination": "Bangkok",
    "accommodation": "Hotel en Bangkok por decidir",
    "transportation": "Llegada 18:40",
    "activities": ["Registro en el hotel", "Cena", "Paseo corto"],
    "reservations": "Vuelo confirmado, hotel pendiente",
    "estimatedBudget": 55,
    "notes": "Mantener la primera noche sencilla después del vuelo.",
    "mapQuery": "Bangkok",
    "imageKey": "bangkok",
    "schedule": [
      { "hour": "18:40", "activity": "Llegada", "transportation": "Avión", "duration": "1 h inmigración", "estimatedCost": "0 EUR", "location": "Aeropuerto BKK/DMK", "bookingStatus": "Confirmado", "notes": "Confirmar aeropuerto exacto." },
      { "hour": "20:00", "activity": "Traslado al hotel", "transportation": "Grab", "duration": "45-75 min", "estimatedCost": "12 EUR", "location": "Hotel por decidir", "bookingStatus": "Pendiente", "notes": "Compartir coche si se puede." },
      { "hour": "21:30", "activity": "Cena", "transportation": "Andando/Grab", "duration": "1 h", "estimatedCost": "15 EUR", "location": "Zona del hotel", "bookingStatus": "Abierto", "notes": "Primera noche tranquila." }
    ]
  },
  {
    "date": "23 ago",
    "destinationId": "bangkok",
    "destination": "Bangkok",
    "accommodation": "Hotel en Bangkok por decidir",
    "transportation": "Grab + barco por el río",
    "activities": ["Grand Palace", "Wat Pho", "Wat Arun", "Khao San Road"],
    "reservations": "Templos sin reservar",
    "estimatedBudget": 80,
    "notes": "Código de vestimenta para templos: hombros y rodillas cubiertos.",
    "mapQuery": "Grand Palace Bangkok",
    "imageKey": "bangkok",
    "schedule": [
      { "hour": "08:00", "activity": "Desayuno", "transportation": "Andando", "duration": "45 min", "estimatedCost": "6 EUR", "location": "Zona del hotel", "bookingStatus": "Abierto", "notes": "Empezar temprano." },
      { "hour": "09:00", "activity": "Grand Palace", "transportation": "Grab", "duration": "2 h", "estimatedCost": "14 EUR", "location": "Grand Palace", "bookingStatus": "Abierto", "notes": "Vestimenta requerida." },
      { "hour": "11:00", "activity": "Wat Pho", "transportation": "Andando", "duration": "1 h", "estimatedCost": "6 EUR", "location": "Wat Pho", "bookingStatus": "Abierto", "notes": "Buda reclinado." },
      { "hour": "12:30", "activity": "Comida", "transportation": "Andando", "duration": "1 h", "estimatedCost": "10 EUR", "location": "Old Town", "bookingStatus": "Abierto", "notes": "Quedarse cerca del pier." },
      { "hour": "14:00", "activity": "Wat Arun", "transportation": "Barco por el río", "duration": "1.5 h", "estimatedCost": "5 EUR", "location": "Wat Arun", "bookingStatus": "Abierto", "notes": "Buena luz por la tarde." },
      { "hour": "19:00", "activity": "Cena", "transportation": "Grab", "duration": "1.5 h", "estimatedCost": "15 EUR", "location": "Chinatown", "bookingStatus": "Abierto", "notes": "Comida callejera." },
      { "hour": "21:00", "activity": "Rooftop", "transportation": "BTS/Grab", "duration": "1.5 h", "estimatedCost": "25 EUR", "location": "Sky bar por decidir", "bookingStatus": "Pendiente", "notes": "Reservar si hace falta." }
    ]
  },
  {
    "date": "24 ago",
    "destinationId": "bangkok",
    "destination": "Bangkok",
    "accommodation": "Tren nocturno u hotel en Bangkok",
    "transportation": "MRT, Grab, posible tren nocturno",
    "activities": ["Pak Khlong Talat", "Song Wat", "Talat Noi", "Chinatown", "Rooftop"],
    "reservations": "Decisión de transporte pendiente",
    "estimatedBudget": 95,
    "notes": "Elegir entre tren y vuelo.",
    "mapQuery": "Bangkok Chinatown",
    "imageKey": "bangkok",
    "schedule": [
      { "hour": "09:00", "activity": "Mercado de flores", "transportation": "MRT/Grab", "duration": "1 h", "estimatedCost": "4 EUR", "location": "Pak Khlong Talat", "bookingStatus": "Abierto", "notes": "Buena parada por la mañana." },
      { "hour": "10:30", "activity": "Song Wat + Talat Noi", "transportation": "Andando", "duration": "2 h", "estimatedCost": "5 EUR", "location": "Song Wat", "bookingStatus": "Abierto", "notes": "Café y fotos." },
      { "hour": "13:00", "activity": "Comida", "transportation": "Andando", "duration": "1 h", "estimatedCost": "12 EUR", "location": "Chinatown", "bookingStatus": "Abierto", "notes": "Comida callejera." },
      { "hour": "22:00", "activity": "Tren nocturno u hotel", "transportation": "Taxi/tren", "duration": "Noche", "estimatedCost": "30-70 EUR", "location": "Estación/aeropuerto", "bookingStatus": "Pendiente", "notes": "Decisión necesaria." }
    ]
  },
  {
    "date": "25 ago",
    "destinationId": "chiang-mai",
    "destination": "Chiang Mai",
    "accommodation": "Hotel en Chiang Mai por decidir",
    "transportation": "Tren o vuelo",
    "activities": ["Old City", "Wat Chedi Luang", "Wat Phra Singh", "Mercado nocturno"],
    "reservations": "Hotel pendiente",
    "estimatedBudget": 75,
    "notes": "Alojarse cerca de Old City o Nimman.",
    "mapQuery": "Chiang Mai Old City",
    "imageKey": "chiang-mai",
    "schedule": [
      { "hour": "12:30", "activity": "Comida de khao soi", "transportation": "Andando/Grab", "duration": "1 h", "estimatedCost": "8 EUR", "location": "Old City", "bookingStatus": "Abierto", "notes": "Probar especialidad local." },
      { "hour": "14:00", "activity": "Wat Chedi Luang", "transportation": "Andando", "duration": "1 h", "estimatedCost": "3 EUR", "location": "Wat Chedi Luang", "bookingStatus": "Abierto", "notes": "En el centro de Old City." },
      { "hour": "19:00", "activity": "Mercado nocturno", "transportation": "Grab", "duration": "2-3 h", "estimatedCost": "20 EUR", "location": "Night Bazaar", "bookingStatus": "Abierto", "notes": "Cena y compras." }
    ]
  },
  {
    "date": "26 ago",
    "destinationId": "chiang-mai",
    "destination": "Excursión a Chiang Rai",
    "accommodation": "Hotel en Chiang Mai por decidir",
    "transportation": "Tour de día / conductor privado",
    "activities": ["Templo Blanco", "Templo Azul", "Black House"],
    "reservations": "Tour pendiente",
    "estimatedBudget": 95,
    "notes": "Día largo: empezar temprano.",
    "mapQuery": "Wat Rong Khun",
    "imageKey": "chiang-mai",
    "schedule": [
      { "hour": "07:00", "activity": "Recogida", "transportation": "Van del tour", "duration": "3 h", "estimatedCost": "Incluido", "location": "Hotel", "bookingStatus": "Pendiente", "notes": "Traslado largo." },
      { "hour": "10:30", "activity": "Templo Blanco", "transportation": "Van del tour", "duration": "1 h", "estimatedCost": "3 EUR", "location": "Wat Rong Khun", "bookingStatus": "Abierto", "notes": "Parada principal." },
      { "hour": "13:30", "activity": "Templo Azul", "transportation": "Van del tour", "duration": "45 min", "estimatedCost": "Gratis", "location": "Wat Rong Suea Ten", "bookingStatus": "Abierto", "notes": "Visita corta." },
      { "hour": "19:30", "activity": "Vuelta", "transportation": "Van del tour", "duration": "Tarde/noche", "estimatedCost": "Incluido", "location": "Chiang Mai", "bookingStatus": "Pendiente", "notes": "Descansar después del día largo." }
    ]
  },
  {
    "date": "27 ago",
    "destinationId": "chiang-mai",
    "destination": "Chiang Mai",
    "accommodation": "Hotel en Chiang Mai por decidir",
    "transportation": "Recogida de tour",
    "activities": ["Santuario ético de elefantes", "Rafting opcional", "Masaje"],
    "reservations": "Santuario pendiente",
    "estimatedBudget": 120,
    "notes": "Verificar estándares éticos del santuario.",
    "mapQuery": "Chiang Mai elephant sanctuary",
    "imageKey": "chiang-mai",
    "schedule": [
      { "hour": "08:00", "activity": "Recogida del santuario", "transportation": "Transporte del tour", "duration": "45 min", "estimatedCost": "Incluido", "location": "Hotel", "bookingStatus": "Pendiente", "notes": "Confirmar estándares éticos." },
      { "hour": "09:00", "activity": "Santuario de elefantes", "transportation": "Tour", "duration": "5-6 h", "estimatedCost": "70 EUR", "location": "Santuario por decidir", "bookingStatus": "Pendiente", "notes": "Sin montar elefantes." },
      { "hour": "16:00", "activity": "Masaje", "transportation": "Grab", "duration": "1 h", "estimatedCost": "10 EUR", "location": "Old City", "bookingStatus": "Abierto", "notes": "Opcional." }
    ]
  },
  {
    "date": "28 ago",
    "destinationId": "koh-tao",
    "destination": "Koh Tao",
    "accommodation": "Hotel en Koh Tao por decidir",
    "transportation": "Vuelo + bus + ferry",
    "activities": ["Día de traslado", "Atardecer en Playa Sairee"],
    "reservations": "Vuelo/ferry pendiente",
    "estimatedBudget": 160,
    "notes": "Reservar conexiones con suficiente margen.",
    "mapQuery": "Playa Sairee, Koh Tao",
    "imageKey": "koh-tao",
    "schedule": [
      { "hour": "07:00", "activity": "Vuelo al sur", "transportation": "Vuelo", "duration": "2 h", "estimatedCost": "60 EUR", "location": "Aeropuerto de Chiang Mai", "bookingStatus": "Pendiente", "notes": "Ruta por decidir." },
      { "hour": "14:00", "activity": "Ferry", "transportation": "Ferry", "duration": "2-3 h", "estimatedCost": "25 EUR", "location": "Pier de Koh Tao", "bookingStatus": "Pendiente", "notes": "Depende de la meteorología." },
      { "hour": "18:00", "activity": "Atardecer en Sairee", "transportation": "Andando/taxi", "duration": "1 h", "estimatedCost": "Gratis", "location": "Playa Sairee", "bookingStatus": "Abierto", "notes": "Primera noche tranquila." }
    ]
  },
  {
    "date": "29 ago",
    "destinationId": "koh-tao",
    "destination": "Koh Tao",
    "accommodation": "Hotel en Koh Tao por decidir",
    "transportation": "Andando / taxi boat",
    "activities": ["Bautismo de buceo", "Playa Sairee"],
    "reservations": "Centro de buceo pendiente",
    "estimatedBudget": 130,
    "notes": "Confirmar requisitos médicos para bucear.",
    "mapQuery": "Koh Tao dive center",
    "imageKey": "koh-tao",
    "schedule": [